{
  "$schema": "https://json-schema.org/draft/2020-12/schema",
  "$id": "https://vanducng.dev/schemas/auto-loop/goal-state.json",
  "title": "vd:auto-loop goal-state.json",
  "description": "Per-iteration model-written state file. Atomic-write only via state-rw.sh.",
  "type": "object",
  "additionalProperties": false,
  "required": [
    "schema_version",
    "iteration",
    "status",
    "evidence",
    "blockers",
    "next_action",
    "tokens_used",
    "started_at",
    "last_update",
    "last_diff_signature"
  ],
  "properties": {
    "schema_version": {
      "type": "integer",
      "const": 1,
      "description": "Schema version for forward-compatible migrations."
    },
    "iteration": {
      "type": "integer",
      "minimum": 0,
      "description": "Loop iteration count (zero-based; starts at 0 on first invocation)."
    },
    "status": {
      "type": "string",
      "enum": ["pursuing", "achieved", "unmet", "blocked", "budget-limited", "cancelled"],
      "description": "Current goal status. `achieved` is provisional until two-vote gate confirms."
    },
    "evidence": {
      "type": "array",
      "items": { "type": "string" },
      "maxItems": 20,
      "description": "Up to 20 short evidence strings describing what's been done."
    },
    "blockers": {
      "type": "array",
      "items": { "type": "string" },
      "description": "Outstanding blockers — empty if none."
    },
    "next_action": {
      "type": "string",
      "maxLength": 500,
      "description": "Concrete next step the model intends to take."
    },
    "tokens_used": {
      "type": "integer",
      "minimum": 0,
      "description": "Cumulative tokens consumed; populated by probe-token-usage.sh."
    },
    "started_at": {
      "type": "string",
      "format": "date-time",
      "description": "ISO-8601 timestamp of loop start; set once and immutable."
    },
    "last_update": {
      "type": "string",
      "format": "date-time",
      "description": "ISO-8601 timestamp of most recent state-write."
    },
    "last_diff_signature": {
      "type": "string",
      "description": "sha256 of `git diff --stat` at last update; used by drift watchdog."
    },
    "verifier_result": {
      "type": "string",
      "enum": ["pass", "fail", "flaky", "not-run"],
      "description": "Most recent verifier outcome."
    },
    "audit_vote": {
      "type": "string",
      "enum": ["achieved", "unmet", "blocked", "thrashing", "not-run"],
      "description": "Most recent audit subagent vote."
    },
    "restart_count": {
      "type": "integer",
      "minimum": 0,
      "description": "Number of phase-restarts performed."
    },
    "session_id": {
      "type": "string",
      "description": "Claude Code session id of the live loop owner."
    }
  }
}
