{
  "schema_version": 1,
  "iteration": 0,
  "status": "pursuing",
  "evidence": [],
  "blockers": [],
  "next_action": "begin",
  "tokens_used": 0,
  "started_at": "1970-01-01T00:00:00Z",
  "last_update": "1970-01-01T00:00:00Z",
  "last_diff_signature": "",
  "verifier_result": "not-run",
  "audit_vote": "not-run",
  "restart_count": 0,
  "session_id": ""
}
